text,label,pre_labeled,corrected,notes
It's higher up than the Luka trade lol,hot_take,True,False,
"Small ball wins championships, Wemby can't run a break like Draymond Green. We'll throw in a first and it's a done deal.",hot_take,True,False,
My mind has been absolutely blown in the last 20 minutes. This sub is truly a wondrous place.,analysis,True,False,
"Thank goodness this sub wasn't as populated in 2016, or the 3-1 memes would've been top all time",hot_take,True,False,
Steph Curry's 3 point record will never be broken due to the NBA going into another shift of play style away from this 3 point era once he retires.,hot_take,True,False,
Gobert is underrated and gets way too much flack for his playoff performances. The Utah Jazz roster is built in a way that he is responsible for covering up for everyone's defensive deficiencies.,hot_take,True,False,
"McDaniels locked down Murray who through the series shot 35.7% from the field and 26% from 3, compared to 48% from the field and 43% from 3 during the regular season, taking away a ton of Denver's spacing.",hot_take,True,False,
Not a single person in NBA media will acknowledge that Jokic's atrocious defensive skills were the primary reason why even the 5th backcourt player of the Minnesota Timberwolves could effortlessly attack and dominate a game.,hot_take,True,False,
Jokic fans are in hiding now but in a month they will say he is better than prime LeBron. The Ringer is the number one offender when it comes to overhyping Jokic historically.,hot_take,True,False,
"Rudy is a 4x DPOY not some average dude. The narrative for most of their careers was that Gobert couldn't guard Jokic, but he completely flipped that this series.",analysis,True,False,
"Reddit seems to forget how good Gobert is. People here tend to think of him first as being a guy Shaq was mean to, and forget that he's an all time great defender.",analysis,True,False,
Jokic's PR is gone after this series. Get ready for the Jokic isn't a top 5 player anymore takes everywhere.,hot_take,True,False,
Top 10 player ever but has been out of the second round twice in his 12 year career. It's crazy how much leeway this guy gets in every regard.,analysis,True,False,
"The New York Knicks are only the third team in NBA history to win the NBA Championship without a player who received MVP votes for the regular season, joining the 77-78 Washington Bullets and the 67-68 Celtics.",analysis,True,False,
"Even the 2004 Pistons, who many point to as an outlier in having no stars, had Ben Wallace receiving MVP votes and going on to finish 7th overall in MVP voting.",analysis,True,False,
"I think this says more about MVP voting this year than it does about Brunson or the Knicks. Only 8 players received votes this year, which is the lowest since 68-69. NBA media is in an echo chamber.",analysis,True,False,
"Jokic, SGA, Wemby, and Luka are all clearly top 4 generational talents in their primes. You don't deserve your vote if you didn't put them in the top 4 based on regular season stats and record. So it's not surprising only 4 other players received votes.",hot_take,True,False,
"This years voting was really just about who you put fifth. Brunson would have been an OK option but if you're honest and don't let recency bias cloud your view, Brunson did not have a better regular season than Brown or Cade.",analysis,True,False,
"In a span of 6 minutes in the 4th quarter of Game 5, Brunson scored 13 straight points and 15 of 17 to take the Knicks from a 10 point deficit with 8 minutes remaining to a 2 point lead with 1 minute remaining. Up there with all-time championship-clinching stretches like Jordan in the 1998 closeout game.",analysis,True,False,
"Brunson a winner at every level. He took the pay-cut, managed his way through the regular season and cranked up when there was something real to play for. He has taken three of the four MVP trophies available this postseason.",analysis,True,False,
"In 1969, rookie Wes Unseld stole the MVP from Willis Reed despite only getting 68% of the ROTY vote. The next year he was only 8th in MVP voting and not an All-Star nor All-NBA.",analysis,True,False,
"The 77-78 Bullets went through a gauntlet against the Iceman, Dr J, and Sikma. They deserve more flowers for their win.",analysis,True,False,
Luka became a distant third in MVP voting in 2024 despite being borderline superhuman that season. That made it pretty clear most voters do not actually watch a lot of games.,analysis,True,False,
Looks like all the bigs chose Wemby and all the perimeter players chose perimeter defenders. Chet only got one vote too.,analysis,True,False,
"Wemby and Gobert are obviously better defenders than Chet and also play center. Even if a voter most valued the specific skillset Chet brings, they would end up rating him as the third best defender. It's hard to imagine the analysis that would lead to anyone ranking Chet number 1.",analysis,True,False,
"When Chet was on the court this season 24.26% of opponents shots were at the rim and they'd only shoot 57.84% at the rim. When he was off the court that FG% rises to 64.31%. When Gobert was on the court opponents shot 63.48% at the rim, and when he was off the court that stayed about the same at 63.3%.",analysis,True,False,
"Rudy Gobert is a four-time DPOY who should probably have five, and just had arguably a top 3 defensive impact season of his career at age 33, and real human beings will tell you he's not good simply because they don't like him.",analysis,True,False,
I imagine a lot of ball handlers vote based on who they view as the best 1 on 1 defenders at the point of attack. In the current NBA those guys will never be as impactful as rim defenders because teams just force switches to preferred matchups.,analysis,True,False,
"Players don't pick Gobert because he's not a great 1 on 1 defender when he gets baited out, but he's great when you funnel everyone towards him. Whereas Wemby, you go past him and you still get your ass blocked after sidestepping.",analysis,True,False,
Only 41% is honestly lowkey crazy. A ton of the names taking up a share on this list aren't really close enough to be considered better defenders than Wemby. 12 blocks is insane even accounting for some goaltending calls.,analysis,True,False,
Rudy is still the 2nd best defender on this list. He shut down Jokic and is trying to carry that momentum to Wemby and the Spurs. He's been what's gotten the Wolves to the second round on defense.,analysis,True,False,
"Being a giant human being is by far the most important part of defense — stopping shots at the rim or keeping offense away from the rim so wing defenders can commit to hard perimeter defense. Rudy, Chet, and Wemby just by being enormous do that on top of being very good at what they do.",analysis,True,False,
Chet on the perimeter — when Chet is on the court opponents shoot 35.7% from 3 vs 37.1% when off. Gobert on/off for opponent 3pt shooting is 35% on and 35.3% off. Chet is mobile enough to get out to corners and contest while still protecting the rim.,analysis,True,False,
"Don't let Brunson's MVP performance distract you from the fact that Fox shot 3/13, 8/12, 4/14, 6/16, 3/15. High volume clanker.",hot_take,True,False,
Harper not playing 40 minutes a game will go down as one of the worst coaching decisions of all time. He is already top 10 in RAPM.,hot_take,True,False,
Fox going 3-15 and still continuing to run the offense through him in the final 5 minutes while his backup is on fire is the most predictable yet still devastating result of this game,reaction,True,False,
I know its cliche to say but the Spurs win this series easily with Pop instead of Mitch Johnson. They clearly had the talent considering they had massive leads in literally every game but mentally collapsed every 4th quarter,hot_take,True,False,
Fourth quarter Spurs collapse is simply inevitable,reaction,True,False,
Some people are just born to win and Brunson is definitely one of them,reaction,True,False,
Spurs losing double digit leads two games in a row is crazy. Wemby a choke artist. Knicks got their win!,reaction,True,False,
GG Knicks. Brunson ability to drive to the basket is unreal and the Knicks just played great and never gave up,reaction,True,False,
I was crying as a 9 year old kid in 1994. I am SO FUCKING HAPPY right now,reaction,True,False,
The year is 2026 and I got to call my father to finally celebrate one of our teams winning a championship. I've watched games across all of sports with him from hospital beds and dialysis chairs while he battled cancer twice. This means the world to us.,reaction,True,False,
mamdani becomes mayor and the knicks immediately win a championship coincidence i think not,reaction,True,False,
This Knicks team breaks the mold for how everyone thinks you should build a team. 4 high paid players. No second option. No bench. One ball handler. The leader is a small PG. All of those things are the opposite of how every other GM builds a team.,analysis,True,False,
"Championship as a HC, 4x champion as an assistant, 2x COTY, 60% win percentage. Mike Brown deserves to be up there with guys like Spoelstra in these conversations.",analysis,True,False,
Wemby a pussy for that bro at least go shake hands with a few guys,reaction,True,False,
This one hurts. I'm sick to my stomach. He did everything he could and they just let him down with the horrific shooting and decision making.,reaction,True,False,
Knicks won 14 of their last 15 and the one loss was the Trump game,reaction,True,False,
Fox and Castle combined 4/25,reaction,True,False,
Congratulations to the Knicks. We are still inexperienced and it showed. Start Harper next season and fire Fox into the sun.,reaction,True,False,
I genuinely believed that Mitch Johnson was a good coach but this series was coaching malpractice. Fox getting more minutes than Harper all series while averaging below 35% on all shots and running all of your clutch offense through him despite endless late-game errors.,hot_take,True,False,
Incredible comebacks by the Knicks all series. Youth and inexperience of Spurs showed time and time again.,reaction,True,False,
NYC gonna burn tonight but damn Knicks had a killer run.,reaction,True,False,
I'm a New Yorker and legit fireworks are going off EVERYWHERE right now. WE OUTSIDEEEEE,reaction,True,False,
An all time NBA performance from Brunson,reaction,True,False,
I can't even describe how much I love Brunson. NYC legend until the end of time.,reaction,True,False,
I'm in my mid 30s. Been a Knicks fan 20+ years. I've seen some trash. Same as all Knicks fans. This is I can't even describe. Holy fuck.,reaction,True,False,
man i cried last night watching those guys win and i cried again watching the clips this morning. thinking about all them times i went to school the next day after the bulls whooped our ass,reaction,True,False,
Seeing happy KAT hold that trophy is good for the soul,reaction,True,False,
hurts to see as a nuggets fan but you cant hate on brunson. left all that money on the table and it actually paid off. respect where its due,reaction,True,False,
Brunson is immortalized in knicks folklore,reaction,True,False,
You can't win a championship with Brunson??? fuck yall we CHAMPIONS,reaction,True,False,
New York is burning down tonight,reaction,True,False,
Wemby got waxed and it was so satisfying to watch. New York stand the fuck up,reaction,True,False,
I think it's pretty safe to say Brunson and KAT are going to have their jerseys retired in NY,reaction,True,False,
At a certain point it's not inexperience when you dominate 80% of the series and still lose 4-1. That's poor coaching and rotations and being anti-clutch.,analysis,True,False,
The Wemby hate is nothing to what LeBron had to go through,hot_take,True,False,
Wemby is going to be an all time great player but this doesn't take away the fact that he is still very immature mentally and makes countless dirty plays.,hot_take,True,False,
No one forced me to hate Wemby. I decided for myself.,hot_take,True,False,
He was cocky and dismissive of the media in his interviews. Now that he lost they are going after him. Jalen dealt with far worse. He was always overlooked and dismissed even after achieving every accolade.,hot_take,True,False,
Wemby is a dirty player that deserves the hate. The only reason it got this far is because the Timberwolves were cowards and didn't take his head off for the elbow to Naz.,hot_take,True,False,
He's a hypocrite. A very talented and somewhat dirty hypocrite with an MVP and championship very likely in his future. He will likely mature quickly and learn a lot.,hot_take,True,False,
Wemby did some dirty shit. He brought it upon himself.,hot_take,True,False,
I went from liking Wemby to fucking despising him after these playoffs. He's a dirty player that tried to hurt multiple players and he's a sore loser.,hot_take,True,False,
I rooted for him during the OKC series but in the Knicks series he was just downright dirty. That Zaza thing he pulled deserved a suspension.,hot_take,True,False,
"He talked a lot of shit and now he gets to learn what that brings from media, NBA players and fans. Part of the cycle.",hot_take,True,False,
The Wemby hate is forced. He's 22 years old coming off a blood clot and just led the Spurs through a historic playoff run.,hot_take,True,False,
You don't get to throw elbows just because you're young.,hot_take,True,False,
It's not that deep. If you want to say he is the face of the league that comes with face of the league treatment.,hot_take,True,False,
Wemby's knees entered the chat.,reaction,True,False,
"Playoff experience is huge at this time of the year. In recent years: 25 Rockets was the second seed and was a first round exit, 24 Thunder was the first seed and was a second round exit, 23 Kings was the third seed and was a first round exit, 22 Grizzlies was the second seed and was a first round exit.",analysis,True,False,
"There is basically no example of a team winning when their best player hasn't played a playoff game. Not Larry, not Cousy, not Russell, not Jordan, not LeBron, not Kareem. Closest was Wilt who was league MVP in his rookie season and lost in the east coast finals.",analysis,True,False,
"The problem with the experience argument is that the better players usually have had played in the playoffs anyway, so it doesn't really have to do with playoff experience as opposed to how good the player themselves are.",analysis,True,False,
"Post all star break, here are the 3pt percentages of Spurs players: Dylan Harper 47.9%, Devin Vassell 43.5%, Barnes 43.0%, Castle 41.7%, Champagnie 40.7%. Despite not being great from 3, Fox, KJ and Wemby still have good FG% at 46.9%, 51.4%, and 49.1%.",analysis,True,False,
The Spurs were something like 28 and 0 when they shot 40% from distance. When they're hitting their shots they're literally unbeatable. When they're not you can crash the paint and make things difficult for their slashing base attack.,analysis,True,False,
I think their downfall is their 3 point shooting more than experience. They have fake shooters more than the experience factor being a problem.,analysis,True,False,
Basketball reference playoff odds has them at 27% to make the finals. That seems slightly high. If they get past the Blazers it's a coin flip against Denver and against OKC more like 60/40.,analysis,True,False,
"Wemby competed against the US team in a great game with the second best player being Nicolas Batum. Wemby is playoff ready. So is Fox, Kornet and Barnes. More importantly the Spurs organization is ready.",analysis,True,False,
"The Spurs are significantly better than a typical 4th seed in every metric: offense, defense, win total, net rating, and their best player is an MVP candidate and DPOY. They could lose to the Nuggets or Thunder but that is the highest bar in the league.",analysis,True,False,
Writing them off strictly because they're young is lazy. They have actual faults like any other team. What completely unrelated players have done in the past shouldn't hold as much weight.,analysis,True,False,
Thibs died for this,reaction,True,False,
Adam Silver is a vampire,reaction,True,False,
I love they ripped that trophy away from Dolan,reaction,True,False,
Fuck James Dolan,reaction,True,False,
Spurs couldn't stick to the script. Game 6? Nah. We'll end it in 5. Sure the Spurs wet the bed over and over when it mattered most.,reaction,True,False,
LETS GO,reaction,True,False,
Never let these clowns forget that slogan of The WCF was the real finals.,reaction,True,False,
New York Legend Brunson!,reaction,True,False,
Probably for the best since the Spurs will likely terrorize the league for years to come,reaction,True,False,
WHO LET THE DOGS OUT,reaction,True,False,
That ain't your voice KAT lmao,reaction,True,False,
IT SHOULD HAVE BEEN IN THE GARDEN FUCK YOU TRUMP,reaction,True,False,
This is a millennial ass celly. I love it lmao,reaction,True,False,
OG SMILING,reaction,True,False,
UNC IS GOING OFF,reaction,True,False,
Wemby and Chet need to go on the same retreat to Siberia during this offseason,reaction,True,False,
It only took 53 years. I still can't believe they won. Love this team.,reaction,True,False,
Knicks were legit DAWGS this entire postseason. One of the most well earned titles.,reaction,True,False,
Spurs didn't shake hands after. What a bunch of sore losers.,reaction,True,False,
Admittedly it's very funny that KAT got a ring before Jimmy Butler,reaction,True,False,
The city of New York is gonna look like the aftermath of an Avengers movie lol,reaction,True,False,
Jalen Brunson was generational in this game. 4th Quarter Finals Brunson is one of the greatest ever,analysis,True,False,
Biggest choke job in Finals history and it isn't close. Between the historic 29 point choke and being up in every game this Spurs team just gave away a title.,reaction,True,False,
That was a fantastic series. Can't remember a 5 game series being so great,reaction,True,False,
Fox had 7 points on 3/15 shooting in 37 minutes. He cost his team the series.,hot_take,True,False,
Just pure emotion on Brunson's face. He deserves this.,reaction,True,False,
"Brunson is so fking likeable, what a great interview. Love the shoutout to all the time spent getting to this point.",reaction,True,False,
Genuinely happy as fuck for KAT.,reaction,True,False,
"james dolan winning anything is an L but congrats Knicks, nobody thought you would win except yall. build brunson that statue",reaction,True,False,
I know the Spurs were ahead of schedule but they choked away all 4 games. That might linger.,hot_take,True,False,
suspend wemby for game 1 of next season,reaction,True,False,
Silver was shook he got booed lmao,reaction,True,False,
It only took 53 years. I still can't believe they won. Love this team.,reaction,True,False,
Jalen's so damn likable,reaction,True,False,
Imagine firing Mike Brown what a fucking coach,reaction,True,False,
I apologize for everything bad I ever said about Mike Brown,reaction,True,False,
KAT has me crying bro,reaction,True,False,
LOVE YOU FOREVER MIKAL FUCK YEAH GET YO RING,reaction,True,False,
"What do Reggie Miller, Tyrese Halliburton and Wemby have in common? They all got cocky and they all have zero rings.",reaction,True,False,
NYC is both overjoyed and terrified at the same time,reaction,True,False,
Hell of a series by the Knicks they absolutely deserved this championship also damn 16-3 is an elite postseason,reaction,True,False,
